{"active_regions":[{"area_msh":809.262584,"birth":{"lat_deg":14.950528,"lon_deg":80.355866,"time_seconds":0.0},"complexity":0.366257,"confidence":0.65,"flux_norm":1.3543,"id":1,"model_position":{"at_time_seconds":0.0,"lat_deg":14.950528,"lon_deg":80.355866,"semantics":"advected_model_anchor"},"polarity":"leading_positive","tilt_deg":16.180591},{"area_msh":1273.648529,"birth":{"lat_deg":-10.53635,"lon_deg":78.709671,"time_seconds":0.0},"complexity":0.624249,"confidence":0.65,"flux_norm":1.213933,"id":2,"model_position":{"at_time_seconds":0.0,"lat_deg":-10.53635,"lon_deg":78.709671,"semantics":"advected_model_anchor"},"polarity":"leading_negative","tilt_deg":-4.477647},{"area_msh":1417.581532,"birth":{"lat_deg":13.967931,"lon_deg":212.135646,"time_seconds":0.0},"complexity":0.704212,"confidence":0.65,"flux_norm":1.744792,"id":3,"model_position":{"at_time_seconds":0.0,"lat_deg":13.967931,"lon_deg":212.135646,"semantics":"advected_model_anchor"},"polarity":"leading_positive","tilt_deg":4.116978},{"area_msh":1178.093104,"birth":{"lat_deg":12.798631,"lon_deg":344.596706,"time_seconds":0.0},"complexity":0.571163,"confidence":0.65,"flux_norm":0.939166,"id":4,"model_position":{"at_time_seconds":0.0,"lat_deg":12.798631,"lon_deg":344.596706,"semantics":"advected_model_anchor"},"polarity":"leading_positive","tilt_deg":5.669425},{"area_msh":1486.359457,"birth":{"lat_deg":24.528309,"lon_deg":262.703443,"time_seconds":0.0},"complexity":0.742422,"confidence":0.65,"flux_norm":1.330306,"id":5,"model_position":{"at_time_seconds":0.0,"lat_deg":24.528309,"lon_deg":262.703443,"semantics":"advected_model_anchor"},"polarity":"leading_positive","tilt_deg":21.516084},{"area_msh":1750.403457,"birth":{"lat_deg":21.133356,"lon_deg":310.214484,"time_seconds":0.0},"complexity":0.889113,"confidence":0.65,"flux_norm":1.49098,"id":6,"model_position":{"at_time_seconds":0.0,"lat_deg":21.133356,"lon_deg":310.214484,"semantics":"advected_model_anchor"},"polarity":"leading_negative","tilt_deg":16.682293},{"area_msh":1118.583917,"birth":{"lat_deg":-11.436256,"lon_deg":83.804719,"time_seconds":0.0},"complexity":0.538102,"confidence":0.65,"flux_norm":0.59311,"id":7,"model_position":{"at_time_seconds":0.0,"lat_deg":-11.436256,"lon_deg":83.804719,"semantics":"advected_model_anchor"},"polarity":"leading_negative","tilt_deg":-9.003525},{"area_msh":1213.111732,"birth":{"lat_deg":-13.771127,"lon_deg":96.112016,"time_seconds":0.0},"complexity":0.590618,"confidence":0.65,"flux_norm":1.831265,"id":8,"model_position":{"at_time_seconds":0.0,"lat_deg":-13.771127,"lon_deg":96.112016,"semantics":"advected_model_anchor"},"polarity":"leading_negative","tilt_deg":-15.664637},{"area_msh":1633.078354,"birth":{"lat_deg":-12.941245,"lon_deg":136.603959,"time_seconds":0.0},"complexity":0.823932,"confidence":0.65,"flux_norm":2.163187,"id":9,"model_position":{"at_time_seconds":0.0,"lat_deg":-12.941245,"lon_deg":136.603959,"semantics":"advected_model_anchor"},"polarity":"leading_negative","tilt_deg":-15.519996},{"area_msh":1766.136747,"birth":{"lat_deg":23.967998,"lon_deg":82.457306,"time_seconds":0.0},"complexity":0.897854,"confidence":0.65,"flux_norm":0.508186,"id":10,"model_position":{"at_time_seconds":0.0,"lat_deg":23.967998,"lon_deg":82.457306,"semantics":"advected_model_anchor"},"polarity":"leading_positive","tilt_deg":9.678155},{"area_msh":1883.204366,"birth":{"lat_deg":-25.774617,"lon_deg":113.284037,"time_seconds":0.0},"complexity":0.962891,"confidence":0.65,"flux_norm":1.684965,"id":11,"model_position":{"at_time_seconds":0.0,"lat_deg":-25.774617,"lon_deg":113.284037,"semantics":"advected_model_anchor"},"polarity":"leading_negative","tilt_deg":-11.121374},{"area_msh":1089.909795,"birth":{"lat_deg":-14.439295,"lon_deg":202.092528,"time_seconds":0.0},"complexity":0.522172,"confidence":0.65,"flux_norm":0.817678,"id":12,"model_position":{"at_time_seconds":0.0,"lat_deg":-14.439295,"lon_deg":202.092528,"semantics":"advected_model_anchor"},"polarity":"leading_negative","tilt_deg":-14.522548},{"area_msh":1036.605288,"birth":{"lat_deg":-27.955677,"lon_deg":183.429466,"time_seconds":0.0},"complexity":0.492558,"confidence":0.65,"flux_norm":0.574256,"id":13,"model_position":{"at_time_seconds":0.0,"lat_deg":-27.955677,"lon_deg":183.429466,"semantics":"advected_model_anchor"},"polarity":"leading_negative","tilt_deg":-4.848095},{"area_msh":1706.732856,"birth":{"lat_deg":17.598879,"lon_deg":22.869974,"time_seconds":0.0},"complexity":0.864852,"confidence":0.65,"flux_norm":1.127884,"id":14,"model_position":{"at_time_seconds":0.0,"lat_deg":17.598879,"lon_deg":22.869974,"semantics":"advected_model_anchor"},"polarity":"leading_positive","tilt_deg":21.930185},{"area_msh":1787.112252,"birth":{"lat_deg":10.206658,"lon_deg":259.459855,"time_seconds":0.0},"complexity":0.909507,"confidence":0.65,"flux_norm":1.694433,"id":15,"model_position":{"at_time_seconds":0.0,"lat_deg":10.206658,"lon_deg":259.459855,"semantics":"advected_model_anchor"},"polarity":"leading_positive","tilt_deg":13.665466},{"area_msh":910.516043,"birth":{"lat_deg":17.825775,"lon_deg":163.340534,"time_seconds":0.0},"complexity":0.422509,"confidence":0.65,"flux_norm":1.680193,"id":16,"model_position":{"at_time_seconds":0.0,"lat_deg":17.825775,"lon_deg":163.340534,"semantics":"advected_model_anchor"},"polarity":"leading_positive","tilt_deg":19.765353},{"area_msh":989.0227,"birth":{"lat_deg":26.427301,"lon_deg":313.386685,"time_seconds":0.0},"complexity":0.466124,"confidence":0.65,"flux_norm":0.84924,"id":17,"model_position":{"at_time_seconds":0.0,"lat_deg":26.427301,"lon_deg":313.386685,"semantics":"advected_model_anchor"},"polarity":"leading_positive","tilt_deg":15.501091},{"area_msh":1672.137636,"birth":{"lat_deg":-19.708823,"lon_deg":280.305532,"time_seconds":0.0},"complexity":0.845632,"confidence":0.65,"flux_norm":1.380874,"id":18,"model_position":{"at_time_seconds":0.0,"lat_deg":-19.708823,"lon_deg":280.305532,"semantics":"advected_model_anchor"},"polarity":"leading_negative","tilt_deg":-4.010294},{"area_msh":1867.045381,"birth":{"lat_deg":-25.816994,"lon_deg":299.399591,"time_seconds":0.0},"complexity":0.953914,"confidence":0.65,"flux_norm":1.026375,"id":19,"model_position":{"at_time_seconds":0.0,"lat_deg":-25.816994,"lon_deg":299.399591,"semantics":"advected_model_anchor"},"polarity":"leading_negative","tilt_deg":-5.042653},{"area_msh":880.214539,"birth":{"lat_deg":18.747828,"lon_deg":24.916507,"time_seconds":0.0},"complexity":0.405675,"confidence":0.65,"flux_norm":1.41691,"id":20,"model_position":{"at_time_seconds":0.0,"lat_deg":18.747828,"lon_deg":24.916507,"semantics":"advected_model_anchor"},"polarity":"leading_positive","tilt_deg":17.78502},{"area_msh":1423.270204,"birth":{"lat_deg":-14.771019,"lon_deg":314.075895,"time_seconds":0.0},"complexity":0.707372,"confidence":0.65,"flux_norm":1.128336,"id":21,"model_position":{"at_time_seconds":0.0,"lat_deg":-14.771019,"lon_deg":314.075895,"semantics":"advected_model_anchor"},"polarity":"leading_negative","tilt_deg":-7.812368},{"area_msh":1015.346744,"birth":{"lat_deg":15.610893,"lon_deg":358.253768,"time_seconds":0.0},"complexity":0.480748,"confidence":0.65,"flux_norm":1.32982,"id":22,"model_position":{"at_time_seconds":0.0,"lat_deg":15.610893,"lon_deg":358.253768,"semantics":"advected_model_anchor"},"polarity":"leading_positive","tilt_deg":11.885802},{"area_msh":1042.895884,"birth":{"lat_deg":-16.08554,"lon_deg":211.791139,"time_seconds":0.0},"complexity":0.496053,"confidence":0.65,"flux_norm":0.765409,"id":23,"model_position":{"at_time_seconds":0.0,"lat_deg":-16.08554,"lon_deg":211.791139,"semantics":"advected_model_anchor"},"polarity":"leading_positive","tilt_deg":-7.963913},{"area_msh":1047.861887,"birth":{"lat_deg":26.29756,"lon_deg":309.468744,"time_seconds":0.0},"complexity":0.498812,"confidence":0.65,"flux_norm":0.547336,"id":24,"model_position":{"at_time_seconds":0.0,"lat_deg":26.29756,"lon_deg":309.468744,"semantics":"advected_model_anchor"},"polarity":"leading_positive","tilt_deg":8.284083},{"area_msh":934.804863,"birth":{"lat_deg":-26.839256,"lon_deg":205.575514,"time_seconds":0.0},"complexity":0.436003,"confidence":0.65,"flux_norm":1.066648,"id":25,"model_position":{"at_time_seconds":0.0,"lat_deg":-26.839256,"lon_deg":205.575514,"semantics":"advected_model_anchor"},"polarity":"leading_negative","tilt_deg":-18.12315},{"area_msh":893.409053,"birth":{"lat_deg":-17.758921,"lon_deg":152.488304,"time_seconds":0.0},"complexity":0.413005,"confidence":0.65,"flux_norm":1.047467,"id":26,"model_position":{"at_time_seconds":0.0,"lat_deg":-17.758921,"lon_deg":152.488304,"semantics":"advected_model_anchor"},"polarity":"leading_negative","tilt_deg":-17.123365},{"area_msh":895.148909,"birth":{"lat_deg":17.247183,"lon_deg":122.148938,"time_seconds":0.0},"complexity":0.413972,"confidence":0.65,"flux_norm":1.553259,"id":27,"model_position":{"at_time_seconds":0.0,"lat_deg":17.247183,"lon_deg":122.148938,"semantics":"advected_model_anchor"},"polarity":"leading_positive","tilt_deg":8.475814},{"area_msh":1273.601519,"birth":{"lat_deg":-15.013813,"lon_deg":89.930321,"time_seconds":0.0},"complexity":0.624223,"confidence":0.65,"flux_norm":1.84565,"id":28,"model_position":{"at_time_seconds":0.0,"lat_deg":-15.013813,"lon_deg":89.930321,"semantics":"advected_model_anchor"},"polarity":"leading_negative","tilt_deg":-11.976353},{"area_msh":839.188346,"birth":{"lat_deg":27.987084,"lon_deg":300.969931,"time_seconds":0.0},"complexity":0.382882,"confidence":0.65,"flux_norm":1.657535,"id":29,"model_position":{"at_time_seconds":0.0,"lat_deg":27.987084,"lon_deg":300.969931,"semantics":"advected_model_anchor"},"polarity":"leading_positive","tilt_deg":20.674606},{"area_msh":1348.200117,"birth":{"lat_deg":-13.847451,"lon_deg":144.374505,"time_seconds":0.0},"complexity":0.665667,"confidence":0.65,"flux_norm":0.541309,"id":30,"model_position":{"at_time_seconds":0.0,"lat_deg":-13.847451,"lon_deg":144.374505,"semantics":"advected_model_anchor"},"polarity":"leading_negative","tilt_deg":-10.821516},{"area_ms